,number,value,datetime_start,datetime_complete,duration,params_batch_size,params_buffer_size,params_gamma,params_learning_starts,params_log_std_init,params_lr,params_net_arch,params_tau,params_train_freq,state
0,0,0.012857605588789305,2021-05-03 16:38:58.541778,2021-05-03 16:44:12.595329,0 days 00:05:14.053551,64,10000,0.999,0,-0.70060772437556,0.00823522968316834,medium,0.005,300,COMPLETE
1,1,0.0343942233701075,2021-05-03 16:44:12.599261,2021-05-03 16:49:32.497948,0 days 00:05:19.898687,64,10000,0.999,0,-0.4912567571362412,0.008658015702976259,medium,0.005,300,COMPLETE
2,2,0.03752291021842441,2021-05-03 16:49:32.501828,2021-05-03 16:51:19.813860,0 days 00:01:47.312032,128,10000,0.9999,10000,0.905672833493278,0.4108768143172664,medium,0.05,10,COMPLETE
3,3,0.00909316315842564,2021-05-03 16:51:19.817674,2021-05-03 16:53:04.942590,0 days 00:01:45.124916,128,100000,0.9999,10000,-3.7641780988935407,0.6869909011918769,small,0.05,10,PRUNED
4,4,0.009157302122642399,2021-05-03 16:53:04.942783,2021-05-03 16:54:52.346534,0 days 00:01:47.403751,128,1000000,0.995,20000,0.9839500957626797,1.2158881135553718e-05,big,0.01,100,PRUNED
5,5,0.013374879488123508,2021-05-03 16:54:52.346732,2021-05-03 16:56:38.763963,0 days 00:01:46.417231,2048,10000,0.9,10000,-3.0995395126947862,0.8109898078324382,medium,0.001,10,PRUNED
6,6,0.01806335583696096,2021-05-03 16:56:38.764162,2021-05-03 17:01:19.643915,0 days 00:04:40.879753,16,1000000,0.99,1000,0.8702450173870873,2.8993871660379453e-05,big,0.05,1,PRUNED
7,7,0.020098366563035486,2021-05-03 17:01:19.644127,2021-05-03 17:03:05.074643,0 days 00:01:45.430516,256,100000,0.98,10000,-2.156002937922742,0.08440556484120137,small,0.02,10,PRUNED
8,8,0.007653741984481599,2021-05-03 17:03:05.074837,2021-05-03 17:14:20.986824,0 days 00:11:15.911987,1024,10000,0.95,1000,0.05701427737353826,0.00039870978333770283,medium,0.05,1,PRUNED
9,9,0.017993237572661844,2021-05-03 17:14:20.987026,2021-05-03 17:16:09.159959,0 days 00:01:48.172933,32,10000,0.9999,10000,-1.9848292894767747,0.11029187153391695,medium,0.01,10,PRUNED
10,10,0.00980359818800377,2021-05-03 17:16:09.160157,2021-05-03 17:17:55.923471,0 days 00:01:46.763314,512,10000,0.9999,20000,0.5154196231918564,0.0003958713673872189,big,0.001,100,PRUNED
11,11,0.018469905729810835,2021-05-03 17:17:55.923673,2021-05-03 17:23:03.134689,0 days 00:05:07.211016,64,10000,0.999,0,-0.5546875229216801,0.014737825929457313,medium,0.005,300,PRUNED
12,12,0.00986432637771086,2021-05-03 17:23:03.134889,2021-05-03 17:28:30.257445,0 days 00:05:27.122556,128,10000,0.999,0,-0.9699272290855585,0.0010686727866695044,medium,0.005,300,PRUNED
13,13,0.036573688915205,2021-05-03 17:28:30.257681,2021-05-03 17:33:30.812123,0 days 00:05:00.554442,64,10000,0.9999,0,-0.020455469975707463,0.09735909807503985,medium,0.05,300,COMPLETE
14,14,0.06274199692134741,2021-05-03 17:33:30.816008,2021-05-03 17:38:39.616867,0 days 00:05:08.800859,64,10000,0.9999,0,0.22908315193577522,0.13966034358832344,medium,0.05,300,PRUNED
15,15,0.021823308159573285,2021-05-03 17:38:39.617079,2021-05-03 17:40:24.817124,0 days 00:01:45.200045,32,100000,0.9999,10000,0.06503365562202335,0.35364537067517277,small,0.05,10,PRUNED
16,16,0.10964739285031606,2021-05-03 17:40:24.817316,2021-05-03 17:53:29.844252,0 days 00:13:05.026936,1024,1000000,0.9999,0,0.9837722367608251,0.042187336379855604,medium,0.05,300,PRUNED
17,17,0.09626025932846696,2021-05-03 17:53:29.844469,2021-05-03 17:55:22.021655,0 days 00:01:52.177186,256,10000,0.95,20000,-1.3779002720129623,0.9303838143249146,medium,0.02,1,COMPLETE
18,18,0.036226012931662895,2021-05-03 17:55:22.025493,2021-05-03 17:57:15.053408,0 days 00:01:53.027915,256,10000,0.95,20000,-1.4925383424633822,0.9735554694196812,medium,0.02,1,PRUNED
19,19,0.007277836425029378,2021-05-03 17:57:15.053634,2021-05-03 17:59:06.824809,0 days 00:01:51.771175,256,100000,0.95,20000,-3.125367972372387,0.2932726596617609,medium,0.02,1,PRUNED
20,20,0.023440137802372626,2021-05-03 17:59:06.825013,2021-05-03 18:01:00.091746,0 days 00:01:53.266733,16,1000000,0.95,20000,-1.3494966858186317,0.02516384836703416,big,0.02,1,PRUNED
21,21,0.024917105834965998,2021-05-03 18:01:00.091948,2021-05-03 18:02:52.138826,0 days 00:01:52.046878,2048,10000,0.98,10000,-2.119636128920475,0.9129097992370355,medium,0.05,1,PRUNED
22,22,0.016736641026426812,2021-05-03 18:02:52.139052,2021-05-03 18:08:07.853440,0 days 00:05:15.714388,128,10000,0.995,1000,0.5025406588081053,0.2549253473672,medium,0.02,10,PRUNED
23,23,0.02636037055193132,2021-05-03 18:08:07.853672,2021-05-03 18:09:53.292745,0 days 00:01:45.439073,256,10000,0.99,20000,-0.22601086263252235,0.056533699916284035,medium,0.05,100,PRUNED
24,24,0.011128444590327172,2021-05-03 18:09:53.292953,2021-05-03 18:11:40.482204,0 days 00:01:47.189251,512,10000,0.9,20000,-1.0031713657714172,0.3706274436868186,medium,0.05,10,PRUNED
25,25,0.053337017398560956,2021-05-03 18:11:40.482411,2021-05-03 18:15:30.627859,0 days 00:03:50.145448,128,10000,0.9999,0,0.5975528568638384,0.0029109772990755013,small,0.01,1,PRUNED
26,26,0.008200008333138352,2021-05-03 18:15:30.628087,2021-05-03 18:17:27.415510,0 days 00:01:56.787423,256,10000,0.95,10000,-2.6582291094691577,0.1704220305880839,medium,0.001,300,PRUNED
27,27,0.01080657879505723,2021-05-03 18:17:27.415728,2021-05-03 18:19:20.254998,0 days 00:01:52.839270,64,10000,0.9999,10000,-1.0662527757813938,0.9910212639947675,medium,0.02,1,PRUNED
28,28,0.009385119038540838,2021-05-03 18:19:20.255197,2021-05-03 18:21:06.348905,0 days 00:01:46.093708,64,10000,0.99,20000,-0.31047249739539984,0.03297867077484837,medium,0.05,10,PRUNED
29,29,0.00911027342636277,2021-05-03 18:21:06.349111,2021-05-03 18:42:07.893500,0 days 00:21:01.544389,2048,10000,0.95,0,-1.8910263247719674,0.5379608256515253,medium,0.02,300,PRUNED
30,30,0.008989828144433682,2021-05-03 18:42:07.893729,2021-05-03 18:47:33.561843,0 days 00:05:25.668114,128,10000,0.9,1000,-0.7787467064544505,0.002917697471821269,medium,0.05,100,PRUNED
31,31,0.026446521115833673,2021-05-03 18:47:33.562096,2021-05-03 18:52:53.945815,0 days 00:05:20.383719,64,10000,0.999,0,-0.3534011722424231,0.00895752025539572,medium,0.005,300,PRUNED
32,32,0.03499154423962128,2021-05-03 18:52:53.946038,2021-05-03 18:58:16.690637,0 days 00:05:22.744599,64,10000,0.999,0,-0.6032136117624689,0.006785920438796597,medium,0.005,300,PRUNED
33,33,0.11680497333675535,2021-05-03 18:58:16.690853,2021-05-03 19:03:21.701678,0 days 00:05:05.010825,64,10000,0.999,0,-1.6971521073712212,0.019557981281627466,medium,0.005,300,PRUNED
34,34,0.021412954043228283,2021-05-03 19:03:21.701896,2021-05-03 19:07:16.610783,0 days 00:03:54.908887,64,100000,0.9999,0,-1.2816047975152136,0.07785413261915201,small,0.005,300,PRUNED
35,35,0.02568285982813889,2021-05-03 19:07:16.611024,2021-05-03 19:12:35.987277,0 days 00:05:19.376253,16,1000000,0.995,0,-0.05511385045568142,0.006074289391478638,big,0.01,300,PRUNED
36,36,0.053349370054983775,2021-05-03 19:12:35.987495,2021-05-03 19:14:23.301444,0 days 00:01:47.313949,128,10000,0.98,10000,0.3255542826603174,0.0014697568507440995,medium,0.005,10,COMPLETE
37,37,0.010650502829811755,2021-05-03 19:14:23.305371,2021-05-03 19:16:10.189124,0 days 00:01:46.883753,128,10000,0.98,10000,0.7690684011504254,5.627754231286194e-05,medium,0.001,10,PRUNED
38,38,0.01046735086069428,2021-05-03 19:16:10.189336,2021-05-03 19:17:57.657961,0 days 00:01:47.468625,128,10000,0.98,10000,0.31219713958325923,0.0003280431619713082,medium,0.005,10,PRUNED
39,39,0.007787795871717167,2021-05-03 19:17:57.658206,2021-05-03 19:19:44.329755,0 days 00:01:46.671549,128,10000,0.98,10000,-2.4628222353523808,0.00025453874732598626,medium,0.05,10,PRUNED
40,40,0.012834444942961178,2021-05-03 19:19:44.329978,2021-05-03 19:21:31.457926,0 days 00:01:47.127948,1024,10000,0.98,10000,-3.8079232967134953,0.001699416214726566,big,0.02,10,PRUNED
41,41,0.008351055774096398,2021-05-03 19:21:31.458134,2021-05-03 19:23:18.447946,0 days 00:01:46.989812,32,10000,0.9999,10000,0.25196463322401197,0.0009754892684643384,medium,0.005,10,PRUNED
42,42,0.012447707983334931,2021-05-03 19:23:18.448171,2021-05-03 19:25:10.205914,0 days 00:01:51.757743,512,10000,0.999,10000,0.7683015693083415,0.0006700693647083517,medium,0.005,10,PRUNED
43,43,0.008639609530147406,2021-05-03 19:25:10.206131,2021-05-03 19:31:56.001222,0 days 00:06:45.795091,128,10000,0.9999,0,-0.09826823795861506,0.0001757418396834391,medium,0.005,300,PRUNED
44,44,0.007857977983129375,2021-05-03 19:31:56.001484,2021-05-03 19:40:17.425117,0 days 00:08:21.423633,256,10000,0.98,1000,0.9857179275633364,0.5779393328181555,medium,0.005,100,PRUNED
45,45,0.011090047834461542,2021-05-03 19:40:17.425353,2021-05-03 19:42:44.995879,0 days 00:02:27.570526,64,100000,0.995,20000,-0.431702486214111,0.012209488263289686,small,0.05,1,PRUNED
46,46,0.009254524706527946,2021-05-03 19:42:44.996088,2021-05-03 19:50:22.667845,0 days 00:07:37.671757,128,1000000,0.999,0,0.42184112369955695,0.1943586146462575,medium,0.01,300,PRUNED
47,47,0.012786481791808777,2021-05-03 19:50:22.668183,2021-05-03 19:52:44.668807,0 days 00:02:22.000624,256,10000,0.95,10000,-0.8286599223047012,0.0017756407028346505,medium,0.05,10,PRUNED
48,48,0.022828541494077113,2021-05-03 19:52:44.669043,2021-05-03 19:55:13.580609,0 days 00:02:28.911566,64,10000,0.9999,20000,0.08028695066679614,0.09219920345057284,medium,0.001,1,PRUNED
49,49,0.040456459311313905,2021-05-03 19:55:13.580833,2021-05-03 20:01:23.949553,0 days 00:06:10.368720,32,10000,0.9,0,0.5995482267781678,0.003841922034164826,medium,0.005,300,COMPLETE
50,50,0.13682438802436903,2021-05-03 20:01:24.145533,2021-05-03 20:06:55.070007,0 days 00:05:30.924474,32,10000,0.9,0,0.756329310877867,0.00012200152487458455,medium,0.005,300,PRUNED
51,51,0.007481147874928668,2021-05-03 20:06:55.070251,2021-05-03 20:13:17.712695,0 days 00:06:22.642444,32,10000,0.9,0,0.12224269297003523,0.004099361954619971,medium,0.005,300,PRUNED
52,52,0.018337048043326087,2021-05-03 20:13:17.713000,2021-05-03 20:20:52.756660,0 days 00:07:35.043660,32,10000,0.9,0,0.5786812825201813,0.000681077393093864,medium,0.005,300,PRUNED
53,53,0.026563672447171637,2021-05-03 20:20:52.756995,2021-05-03 20:40:19.138057,0 days 00:19:26.381062,1024,10000,0.9,0,-0.1497051451071198,0.0016278129670430738,medium,0.005,300,PRUNED
54,54,0.01041615508525827,2021-05-03 20:40:19.138398,2021-05-03 20:47:37.883741,0 days 00:07:18.745343,16,10000,0.9999,0,0.33481706724426263,0.46359009765686293,medium,0.02,300,PRUNED
55,55,0.011673031505126589,2021-05-03 20:47:37.883966,2021-05-03 20:49:55.254195,0 days 00:02:17.370229,32,10000,0.99,10000,-0.5762332108392748,0.004295593487847675,big,0.05,10,PRUNED
56,56,0.01271486257157397,2021-05-03 20:49:55.254418,2021-05-03 20:52:28.519952,0 days 00:02:33.265534,2048,100000,0.95,20000,0.5190356808807325,0.05312026533583664,medium,0.005,1,PRUNED
57,57,0.02715365862879949,2021-05-03 20:52:28.520202,2021-05-03 21:00:06.438803,0 days 00:07:37.918601,256,1000000,0.9999,1000,0.9430708051837535,0.013414665270817553,medium,0.05,300,PRUNED
58,58,0.007650256638934642,2021-05-03 21:00:06.439042,2021-05-03 21:05:57.418408,0 days 00:05:50.979366,128,10000,0.999,0,-1.2599469841055178,0.23765859635181477,medium,0.02,100,PRUNED
59,59,0.010116696439211832,2021-05-03 21:05:57.418660,2021-05-03 21:07:43.424933,0 days 00:01:46.006273,512,10000,0.95,10000,0.12253796031271791,0.12392524527951249,small,0.05,10,PRUNED
60,60,0.01781399749477069,2021-05-03 21:07:43.425159,2021-05-03 21:09:36.972968,0 days 00:01:53.547809,64,10000,0.9,20000,0.653720841926481,0.7889490223373418,medium,0.005,1,PRUNED
61,61,0.07431734701268754,2021-05-03 21:09:36.973231,2021-05-03 21:14:39.332416,0 days 00:05:02.359185,64,10000,0.999,0,-0.7909108836144655,0.02491664781387259,medium,0.005,300,COMPLETE
62,62,0.0296378972179649,2021-05-03 21:14:39.337202,2021-05-03 21:19:43.750713,0 days 00:05:04.413511,64,10000,0.999,0,-1.0837723968209187,0.01720408296980047,medium,0.005,300,PRUNED
63,63,0.049342690997195036,2021-05-03 21:19:43.750974,2021-05-03 21:24:44.305360,0 days 00:05:00.554386,64,10000,0.999,0,-1.5332596205117957,0.0283215739663617,medium,0.005,300,PRUNED
64,64,0.023385642305403406,2021-05-03 21:24:44.305636,2021-05-03 21:29:58.993663,0 days 00:05:14.688027,64,10000,0.999,0,-0.740353408239114,0.008965723196638336,medium,0.005,300,PRUNED
65,65,0.00743919781618861,2021-05-03 21:29:58.993903,2021-05-03 21:35:32.236315,0 days 00:05:33.242412,128,10000,0.9999,0,-0.061445961433367884,0.040604107436250494,medium,0.005,300,PRUNED
66,66,0.011816038971148553,2021-05-03 21:35:32.236543,2021-05-03 21:40:43.443482,0 days 00:05:11.206939,64,10000,0.98,0,-0.45407437295115327,0.004497961460010072,medium,0.02,300,PRUNED
67,67,0.010335471495564142,2021-05-03 21:40:43.443721,2021-05-03 21:47:04.846353,0 days 00:06:21.402632,256,10000,0.999,0,-0.2375248831734943,0.0024417571655788945,medium,0.01,300,PRUNED
68,68,0.013240485345732819,2021-05-03 21:47:04.846575,2021-05-03 21:48:51.593893,0 days 00:01:46.747318,32,10000,0.99,10000,-1.6332371034704316,0.02539532862249381,medium,0.05,10,PRUNED
69,69,0.025280561344495675,2021-05-03 21:48:51.594146,2021-05-03 21:50:44.165676,0 days 00:01:52.571530,64,10000,0.95,20000,-0.8953549403550434,0.07026198315914421,medium,0.001,1,PRUNED
70,70,0.07464050938366427,2021-05-03 21:50:44.165909,2021-05-03 22:29:35.160309,0 days 00:38:50.994400,2048,10000,0.995,0,-1.196316774226295,0.010270426121402337,big,0.005,300,PRUNED
71,71,0.019384144641638377,2021-05-03 22:29:35.160561,2021-05-03 22:34:44.455027,0 days 00:05:09.294466,64,10000,0.999,0,-0.6398263518491515,0.0071926056355516655,medium,0.005,300,PRUNED
72,72,0.03030133497687498,2021-05-03 22:34:44.455256,2021-05-03 22:39:52.474574,0 days 00:05:08.019318,64,10000,0.999,0,-0.41948895472362135,0.01819332920094458,medium,0.005,300,PRUNED
73,73,0.014140077516260518,2021-05-03 22:39:52.474828,2021-05-03 22:45:11.821026,0 days 00:05:19.346198,64,10000,0.999,0,-1.8779087299107737,0.005050826112658304,medium,0.005,300,PRUNED
74,74,0.0060661906782857565,2021-05-03 22:45:11.821266,2021-05-03 22:47:00.410053,0 days 00:01:48.588787,128,10000,0.9999,10000,-0.2508859773841146,0.0020875840529819244,medium,0.005,10,PRUNED
75,75,0.04056953722121637,2021-05-03 22:47:00.410309,2021-05-03 22:51:51.297120,0 days 00:04:50.886811,16,100000,0.98,0,-0.9674583720702508,0.003719953621780821,medium,0.02,300,COMPLETE
76,76,0.018208990369470712,2021-05-03 22:51:51.301310,2021-05-03 22:56:41.561105,0 days 00:04:50.259795,16,100000,0.98,0,-1.022964565282219,0.0012574056115629176,medium,0.02,300,PRUNED
77,77,0.012858932588513568,2021-05-03 22:56:41.561348,2021-05-03 23:02:01.913251,0 days 00:05:20.351903,16,100000,0.98,1000,-1.4907962645547141,0.0030784627383161106,medium,0.02,100,PRUNED
78,78,0.008274972110985336,2021-05-03 23:02:01.913683,2021-05-03 23:07:06.602289,0 days 00:05:04.688606,16,100000,0.98,0,0.39442698962703937,0.36220247374849585,small,0.02,300,PRUNED
79,79,0.014780242116225036,2021-05-03 23:07:06.602517,2021-05-03 23:09:25.549553,0 days 00:02:18.947036,16,100000,0.98,10000,-1.1506568259402847,0.0006410489455304011,medium,0.02,10,PRUNED
80,80,0.010929791068811687,2021-05-03 23:09:25.549799,2021-05-03 23:11:56.631212,0 days 00:02:31.081413,1024,100000,0.98,20000,-0.8811307149830505,0.15657566356928376,medium,0.05,300,PRUNED
81,81,0.011500332185803645,2021-05-03 23:11:56.631434,2021-05-03 23:17:31.976935,0 days 00:05:35.345501,64,1000000,0.999,0,-1.4137410661883276,0.0038500606839473447,medium,0.02,300,PRUNED
82,82,0.06568777159627319,2021-05-03 23:17:31.977191,2021-05-03 23:24:35.490653,0 days 00:07:03.513462,128,10000,0.9999,0,-0.6981782568963744,0.0073437275059479255,medium,0.005,300,COMPLETE
83,83,0.1925074764502946,2021-05-03 23:24:35.494652,2021-05-03 23:32:17.557617,0 days 00:07:42.062965,128,10000,0.9999,0,-0.7260682336855917,0.007202464744943781,medium,0.005,300,COMPLETE
84,84,0.010548865847225909,2021-05-03 23:32:17.617687,2021-05-03 23:40:25.786513,0 days 00:08:08.168826,128,10000,0.9999,0,-0.7391351304180761,0.006226251399491501,medium,0.005,300,PRUNED
85,85,0.009132406729046456,2021-05-03 23:40:25.786759,2021-05-03 23:46:34.427797,0 days 00:06:08.641038,128,10000,0.9999,0,-0.9958011715379439,0.0011470440780275326,medium,0.005,300,PRUNED
86,86,0.01229039163339691,2021-05-03 23:46:34.428042,2021-05-03 23:51:53.909288,0 days 00:05:19.481246,128,10000,0.9999,0,-0.5292792367438431,0.003279631452640384,medium,0.05,1,PRUNED
87,87,0.01131636391013043,2021-05-03 23:51:53.909540,2021-05-03 23:57:49.513059,0 days 00:05:55.603519,128,10000,0.9999,0,0.8657407672580982,0.00542657895339995,medium,0.005,300,PRUNED
88,88,0.016787657116919184,2021-05-03 23:57:49.513320,2021-05-03 23:59:36.762780,0 days 00:01:47.249460,128,100000,0.9999,10000,0.23319751006132983,0.013074707689288699,medium,0.02,10,PRUNED
89,89,0.011933441057694444,2021-05-03 23:59:36.763011,2021-05-04 00:05:25.771635,0 days 00:05:49.008624,128,10000,0.9999,0,-0.6831666069935987,0.010009730401566557,medium,0.01,300,PRUNED
90,90,0.18041010429821513,2021-05-04 00:05:25.771870,2021-05-04 00:13:34.267940,0 days 00:08:08.496070,128,10000,0.9999,0,0.6989555363995883,0.002517867829638697,medium,0.05,300,COMPLETE
91,91,0.01010767552381244,2021-05-04 00:13:34.273808,2021-05-04 00:21:42.963834,0 days 00:08:08.690026,128,10000,0.9999,0,0.7261935340692839,0.0015517707266195142,medium,0.05,300,PRUNED
92,92,0.010015299709020516,2021-05-04 00:21:42.964227,2021-05-04 00:28:36.876756,0 days 00:06:53.912529,128,10000,0.9999,0,0.9278309433632684,0.002344398936153147,medium,0.05,300,PRUNED
93,93,0.02873264698567741,2021-05-04 00:28:36.877015,2021-05-04 00:36:01.166900,0 days 00:07:24.289885,128,10000,0.9999,0,0.4383772353024088,0.0009798923563919693,medium,0.05,300,PRUNED
94,94,0.008128698774381849,2021-05-04 00:36:01.167143,2021-05-04 00:44:17.531068,0 days 00:08:16.363925,256,10000,0.9999,0,-0.9303243523500218,0.00714582195520764,medium,0.05,300,PRUNED
95,95,0.015678533601603976,2021-05-04 00:44:17.531320,2021-05-04 00:50:27.266475,0 days 00:06:09.735155,128,10000,0.9,0,0.8418058829398536,0.652046272092588,medium,0.05,300,PRUNED
96,96,0.01939625400669632,2021-05-04 00:50:27.266727,2021-05-04 00:52:36.221675,0 days 00:02:08.954948,128,10000,0.95,20000,-3.9960414366752195,0.003409734050511078,medium,0.005,1,PRUNED
97,97,0.00764581543970322,2021-05-04 00:52:36.221916,2021-05-04 00:54:41.892475,0 days 00:02:05.670559,32,10000,0.9999,10000,0.6028155477049579,0.002642268294185659,big,0.005,10,PRUNED
98,98,0.021089862812592067,2021-05-04 00:54:41.892716,2021-05-04 01:04:33.769282,0 days 00:09:51.876566,512,10000,0.9999,0,0.03135727001861177,0.0008321750772361044,medium,0.001,300,PRUNED
99,99,0.018404715871441643,2021-05-04 01:04:33.769652,2021-05-04 01:11:12.805840,0 days 00:06:39.036188,128,10000,0.9,0,-1.3169178230041305,0.0019068441684185135,medium,0.05,300,PRUNED
